{
  "schema_version": "registry.pointer.v0.1",
  "registry": {
    "name": "mcp-tool-shop",
    "generated_at_utc": "2026-01-30T21:00:00Z",
    "issuer": "registry@tool-shop"
  },
  "pointers": [
    {
      "tool": "mcp.registry.fixture",
      "channel": "stable",
      "root_cid": "bafybeigdyrzt5sfp7udm7hu76uh7y26nf3efuylqabf3oclgtqy55fbzdi",
      "descriptor_cid": "bafybeigdyrzt5sfp7udm7hu76uh7y26nf3efuylqabf3oclgtqy55fbzdi",
      "cid_profile": {
        "name": "mcp.cidprofile.default",
        "version": "1",
        "hash": "sha2-256",
        "codec": "dag-cbor",
        "base": "base32",
        "normalization": {
          "path_separator": "/",
          "sort_entries": true,
          "strip_timestamps": true,
          "strip_owner": true,
          "strip_permissions": true,
          "reject_symlinks": true
        }
      },
      "updated_at_utc": "2026-01-30T21:00:00Z"
    }
  ],
  "signatures": []
}
