{
  "schema_version": "registry.pointer.v0.1",
  "registry": {
    "name": "mcp-tool-shop",
    "generated_at_utc": "2026-01-30T21:00:00Z",
    "issuer": "registry@tool-shop"
  },
  "pointers": [
    {
      "tool": "mcp.registry.fixture",
      "channel": "stable",
      "root_cid": "bafybeihcyruaeza7uyjd6ugicbcrqumejf6lni7o7q6c7qbw5dj7cdm4ya",
      "descriptor_cid": "bafyreiccjc3fghpvbnh22aurk7uz7s2va25wyiiqtntvqk3cd3jz7dpmwi",
      "cid_profile": {
        "name": "mcp.cidprofile.default",
        "version": "1",
        "hash": "sha2-256",
        "codec": "dag-cbor",
        "base": "base32",
        "normalization": {
          "path_separator": "/",
          "sort_entries": true,
          "strip_timestamps": true,
          "strip_owner": true,
          "strip_permissions": true,
          "reject_symlinks": true
        }
      },
      "updated_at_utc": "2026-01-30T21:00:00Z"
    }
  ],
  "signatures": [
    {
      "key_id": "did:key:z6Mkk2vTZNdMAsnefBSHTzZfmzF4Wq3B72NqrvBE5kuuPwDe",
      "alg": "ed25519",
      "sig": "-torGBdTsTwhzMH7xHO8sPwO3Yc2zJX8y_LGKpc_ascmV1M4ldVb8PTq0qcL-FzDLarG4jgrFQEr4RpPEQEUAg",
      "signed_fields": [
        "/pointers",
        "/registry"
      ]
    }
  ]
}
